{
  "profile_version": "workflow-profile-v1",
  "profile_name": "repository-review-v1",
  "allowed_operations": ["review", "analyze"],
  "executor_profile": "codex-review-v1",
  "pinned_executor_image": "node:22-bookworm-slim@sha256:83f487e0a63425e5b4d146fb5e5be574bcbe1b7b843d3ebafdd95eaf7767a7e5",
  "accepted_input_kinds": ["repository", "text", "log"],
  "workspace_access": "read_only_repository",
  "preprocessor_profiles": [],
  "validation_profile": "review-structured-v1",
  "output_schema": {"schema_name": "repository-review-v1", "schema_version": "1"},
  "allowed_capabilities": ["git_read", "test_read"],
  "network_policy": "none",
  "resource_limits": {"timeout_seconds": 180, "maximum_attempts": 1},
  "enabled": true
}
